{
	"$schema": "https://artisanpack-ui.dev/schemas/theme.json",
	"version": 1,
	"settings": {
		"color": {
			"palette": [
				{ "name": "Primary", "slug": "primary", "color": "#3b82f6" },
				{ "name": "Secondary", "slug": "secondary", "color": "#6366f1" },
				{ "name": "Accent", "slug": "accent", "color": "#f59e0b" },
				{ "name": "Background", "slug": "background", "color": "#ffffff" },
				{ "name": "Surface", "slug": "surface", "color": "#f8fafc" },
				{ "name": "Text", "slug": "text", "color": "#1e293b" },
				{ "name": "Muted", "slug": "muted", "color": "#94a3b8" },
				{ "name": "Border", "slug": "border", "color": "#e2e8f0" },
				{ "name": "Success", "slug": "success", "color": "#22c55e" },
				{ "name": "Warning", "slug": "warning", "color": "#f59e0b" },
				{ "name": "Error", "slug": "error", "color": "#ef4444" },
				{ "name": "Info", "slug": "info", "color": "#3b82f6" }
			]
		},
		"typography": {
			"fontFamilies": {
				"heading": "\"Inter\", sans-serif",
				"body": "\"Inter\", sans-serif",
				"mono": "\"JetBrains Mono\", monospace"
			},
			"elements": {
				"h1": { "fontSize": "2.25rem", "fontWeight": "800", "lineHeight": "1.2" },
				"h2": { "fontSize": "1.875rem", "fontWeight": "700", "lineHeight": "1.25" },
				"h3": { "fontSize": "1.5rem", "fontWeight": "600", "lineHeight": "1.3" },
				"h4": { "fontSize": "1.25rem", "fontWeight": "600", "lineHeight": "1.35" },
				"h5": { "fontSize": "1.125rem", "fontWeight": "600", "lineHeight": "1.4" },
				"h6": { "fontSize": "1rem", "fontWeight": "600", "lineHeight": "1.4" },
				"body": { "fontSize": "1rem", "fontWeight": "400", "lineHeight": "1.6" }
			}
		},
		"spacing": {
			"scale": {
				"xs": "0.25rem",
				"sm": "0.5rem",
				"md": "1rem",
				"lg": "1.5rem",
				"xl": "2rem",
				"2xl": "3rem",
				"3xl": "4rem"
			},
			"blockGap": "md"
		}
	},
	"styles": {
		"blocks": {}
	},
	"templateOverrides": {}
}
